{
  "production_id": "if-2026-07-06-liverpool-arsenal",
  "agent_id": "IF-A04",
  "agent_name": "Insight Engine",
  "prompt_id": "IF-PROMPT-04-INSIGHT-ENGINE",
  "prompt_version": "v1.0",
  "timestamp": "2026-07-06T16:12:49.099762+00:00",
  "story_angle": "Liverpool may have the edge if they turn the first 20 minutes into pressure, but Arsenal have enough quality to punish one mistake.",
  "central_question": "Can Arsenal survive Liverpool's fast start?",
  "insight_summary": "Liverpool's strongest advantage is how aggressively they begin matches, but Arsenal have shown they can recover after difficult starts.",
  "match_edge": "Slight Home Edge",
  "key_advantage": "Early pressure.",
  "tactical_explanation": "Liverpool are likely to press high from kickoff. If Arsenal break that press consistently, the match becomes much more balanced.",
  "uncertainty_summary": "An unexpected Arsenal lineup or an early Liverpool mistake could completely change the pattern.",
  "x_factor": "Arsenal's ability to escape Liverpool's first press.",
  "surprising_takeaway": "The first twenty minutes may decide more than the final score.",
  "viewer_takeaway": "Watch the opening phase closely; it may tell you how the rest of the game will unfold.",
  "editorial_notes": [
    "Insight is based on approved evidence from the Evidence Filter.",
    "Keep the conclusion framed as an edge, not a prediction."
  ],
  "confidence": {
    "score": 79,
    "reason": "Confidence is based on evidence confidence and evidence quality scores."
  },
  "warnings": [
    "FACT_CHECK_REQUIRED: sample evidence must be verified before publishing."
  ],
  "human_review_flags": [
    "FACT_CHECK_REQUIRED"
  ],
  "locked_fields": {
    "story_angle": "Liverpool may have the edge if they turn the first 20 minutes into pressure, but Arsenal have enough quality to punish one mistake.",
    "central_question": "Can Arsenal survive Liverpool's fast start?",
    "surprising_fact": "Sample data: Liverpool have started quickly in recent home matches, while Arsenal have sometimes needed longer to settle away."
  },
  "approval_status": "approved",
  "next_agent": "IF-A05"
}
